byline,headline
By ERIC SCHMITT,"As ISIS Loses Land, It Gains Ground in Stateless Terror"
By SCOTT SHANE,Drone Data Shows Limits of Fighting Terror From the Sky
By JIM RUTENBERG,"When the Media Is Biased, and Doesn’t Try to Hide It"
By ANNIE WALDMAN,"A Student Loan That Can’t Be Forgiven, Not Even by Death"
By SHIVANI VORA,How to Get Your Passport in Order
By SAM SIFTON,Our Best Recipes for the Fourth of July
By SARAH LYALL,‘Brexit’ Upsets a London That Values Its Cultural Cacophony
,Farage Resigns as Head of U.K. Independence Party 10:24 AM ET
,‘Brexit’ Briefing: Mudslinging Among Conservatives 7:41 AM ET
By ADAM LIPTAK,Sotomayor Takes on Criminal Justice System in Dissents
By DWIGHT GARNER,Garrison Keillor Turns Out the Lights on Lake Wobegon
By JEFFREY GETTLEMAN and ISABEL KERSHNER 11:16 AM ET,Netanyahu Traces Path to Power Back to Lost Brother
By KATE MURPHY,Why Tech Support Is (Purposely) Unbearable
By EMMA G. FITZSIMMONS,New Jersey Savors Reprieve From Gas-Tax Increase
,Australian Candidates Woo Allies Amid Deadlock 9:26 AM ET
,Amazon Is Quietly Eliminating List Prices
,"Where ‘Not in My Backyard’ Prevails, Equality Does Not"
,Man Injured by Suspected Fireworks in Central Park
,What Clinton’s First 100 Days in Office Might Look Like
,"Elie Wiesel, Nobel Prize Winner, Dies at 87"
,"In ‘Bush,’ a Biography as a Scathing Indictment"
,A House That Love Built — Before It Was Gone
By SYLVIE KAUFFMANN,Why Frexit Won’t Happen
By TAHMIMA ANAM 6:35 AM ET,Horror and Sorrow in Dhaka
,Join us on Facebook »
By ROBERT G. PARKINSON,A Declaration of Fear
,Editorial: An Exodus in Our Own Backyard
,Blow: Giving Clinton Her Due
,"Krugman: Trump, Trade and Workers"
,"Editorial: This Fourth of July, Proclaim a Break With Brexit"
,"Op-Ed: Fire, Not Fireworks"
,An Irish-German-Chinese Perspective on ‘Brexit’
,"Pool Reporting, Literally"
,An Irish-German-Chinese Perspective on ‘Brexit’
,Play Today’s Puzzle
,Play Today’s Puzzle
,Helpful Theorem
,A Businessman in Ohio Is Confused for a Terrorist
,Editorial: The Salmon’s Swim for Survival
,"Pool Reporting, Literally"
,Rising Seas Threaten Remote Pacific Nation
,The Stone: There Is No Scientific Method
,How I Learned to Tolerate Blake Lively
,Obama After Dark: The Precious Hours Alone
,"Op-Ed: Fire, Not Fireworks"
,Captured by the Lens of Bill Cunningham
,Pillars of Black Media Fight for Survival
,Op-Ed: A Declaration of Fear
,Donald Trump Versus the ‘Haters’
,"Netanyahu Traces Path to Power Back to Entebbe, and Lost Brother"
,Nigel Farage Says He’ll Step Down as Head of U.K. Independence Party
,The Week Ahead: Investors Watch Bank of England for Brexit Plan as U.S. Releases Jobs Report
,A Brooklyn Neighborhood Where Airbnb Is Being Put to the Test
,Editorial: How to Revive the Promise of the European Union
,Frank Bruni: The Utter Inconsequence of Hillary’s Veep
,Black Man’s Fatal Encounter With Police Splits Mississippi City Known for Harmony
,What to Expect When NASA’s Spacecraft Juno Gets to Jupiter
,Still Want to Get the News on Facebook? Read All About It
,App Smart: Third-Party Keyboards Give Mobile Users More Options
,Review: ‘Il Trionfo’ and ‘Pelléas’ at the Aix-en-Provence Festival
,"Books of The Times: Review: ‘Bush,’ a Biography as Scathing Indictment"
,"Donald Trump’s Star of David Tweet Came From a Fringe Website, a Report Says"
,White House Prohibits Cabinet From Addressing Democratic Convention
,Partying on Both Sides of the Champs-Élysées
,Captured by the Lens of Bill Cunningham
,Viggo Mortensen Goes Off the Grid With ‘Captain Fantastic’
,"Michael Cimino, Director of ‘The Deer Hunter’ and ‘Heaven’s Gate,’ Dies at 77"
,"In New Jersey Student Loan Program, Even Death May Not Bring a Reprieve"
,Elie Wiesel Is Recalled at Funeral for a Legacy Beyond His Moral Voice
,Consummate Hitter Ichiro Suzuki Comes in Contact With an Irrefutable Number
,Justin Gatlin Zips to His Third Olympics in Winning the 100 Meters
,James Houghton: The ‘Samurai Spirit’ of Signature Theater
,Critic’s Notebook: Broadway Comes to a Laptop Near You
,"A Space Pioneer, 79, Is Ready to Track Juno for NASA"
,NASA Announces Extension of 9 Spacecraft Missions
,"Elie Wiesel, Auschwitz Survivor and Nobel Peace Prize Winner, Dies at 87"
,"Michael Cimino, Director of ‘The Deer Hunter’ and ‘Heaven’s Gate,’ Dies at 77"
,Review: A Sweet Take on British Identity Returns to PBS
,"Game of Thrones: In ‘Game of Thrones,’ the Pleasures of a Quickened Pace"
,"The New Old Age: What Doctors Know About How Bad It Is, and Won’t Say"
,Well: A Call for Action on Toxic Chemicals
,36 Hours: 36 Hours in Cleveland
,Frugal Traveler: 10 Free (or Cheap) Travel Apps Worth Downloading
,‘The Arrangements’: A Work of Fiction
,"Nonfiction: The Good, the True, the Beautiful and Chuck Klosterman"
,Wyoming Schools Look for a Middle Way for Transgender Students
,A Sea of Charter Schools in Detroit Leaves Students Adrift
,"What to Cook: Recipes, Fireworks, Songs"
,City Kitchen: Spicy Cold Noodles Offer an Antidote to Summer Heat
,Editorial: How to Revive the Promise of the European Union
,Frank Bruni: The Utter Inconsequence of Hillary’s Veep
,Outdoor Decor: A Checklist
,"What I Love: Tamron Hall, of the ‘Today’ Show, Feathers Her Nest"
,Disunion: Why the European Union Could Break if It Does Not Learn to Bend
,The 2016 Race: How Polling Can Go Wrong
,Feature: The Secrets in Guatemala’s Bones
,Feature: How ‘Advantage Players’ Game the Casinos
,"Self-Driving Tesla Was Involved in Fatal Crash, U.S. Says"
,Driven: Video Review: Hyundai’s Plug-In Sonata Saves Fuel With Understatement
,Portraits of London Life (and its Many Subcultures) in the ’70s and ’80s
,"Two Summery Cocktail Recipes, One Handy New App"
,Insider Podcasts: Paul Krugman on ‘Brexit’ and Its Impact
,An Irish-German-Chinese Perspective on ‘Brexit’
By DAN SHAW,"Tamron Hall, of the ‘Today’ Show, Feathers Her Nest"
,Search for Homes for Sale or Rent
,Sell Your Home
By JULIE BESONEN,Gramercy Park: Steeped in History and Grandeur
